{
  "profile": "source-fidelity-review-declaration-1.0",
  "package_context_id": "8d780849594c08f60fe555979a1cf55d16b008fb6dfb6353b76b0c04b8ab42bc",
  "audit_context_id": "9008f6ac7b61bbdbbf2bfd31c6441843c6d1d5685629ffe0c8e4b59a3e80fd0f",
  "unique_claims": 4,
  "calendar_reviews": 1,
  "reviewer": "Explicit authored fixture review for configured item 2001",
  "record_decision": "accept_all_fidelity_verified_claims",
  "record_reason": "Accept the exact authored synthetic records after independent source-fidelity checks; these are fabricated examples, not clinical adjudications.",
  "calendar_decision": "same_patient_calendar",
  "calendar_reason": "The authored fixture defines a common recorded calendar within each synthetic patient.",
  "clinical_mapping_verified": false,
  "reviewer_identity_verified": false
}
