{
  "profile": "source-fidelity-review-declaration-1.0",
  "package_context_id": "3bb4a64921d1b3d3482fefe9df65fc2a7fee01c9c1479a5a50c37a19ce9159ea",
  "audit_context_id": "87841449cd9cf4744e9c07b2e04ab1ce92aa81f784c918d8c52b7d2399ca5398",
  "unique_claims": 9,
  "calendar_reviews": 3,
  "reviewer": "Explicit acceptance of authored synthetic demonstration records",
  "record_decision": "accept_all_fidelity_verified_claims",
  "record_reason": "Accept the exact authored synthetic records after independent source-fidelity checks; these are fabricated examples, not clinical adjudications.",
  "calendar_decision": "same_patient_calendar",
  "calendar_reason": "The authored fixture defines a common recorded calendar within each synthetic patient.",
  "clinical_mapping_verified": false,
  "reviewer_identity_verified": false
}
